{
  "base_sha": "4a9fe7a6a14c2266f8dbc2b90df9baee91a6282e",
  "candidate_sha": "4a9fe7a6a14c2266f8dbc2b90df9baee91a6282e",
  "executor_identity": "local/workstation:executor/luna",
  "findings": [
    {
      "id": "missing-neural-seed-deliverables",
      "message": "Candidate HEAD contains no committed neural-seed GLB, provenance JSON, review document, or neural runtime/top/side renders; the required visual and provenance acceptance criteria cannot be verified.",
      "paths": [
        "art/blender/command-center/neural-seed",
        "art/blender/command-center/neural-seed-provenance.json",
        "art/blender/command-center/neural-seed-review.md",
        "art/blender/command-center/previews/neural-runtime.png",
        "art/blender/command-center/previews/neural-top.png",
        "art/blender/command-center/previews/neural-side.png"
      ],
      "severity": "blocker"
    },
    {
      "id": "protected-paths-modified",
      "message": "Against the candidate's first-parent baseline 1ad71dd, the candidate modifies protected .icm, docs, and workflow paths, contrary to the task contract.",
      "paths": [
        ".icm/state/source.json",
        "docs/portfolio-world/COMMAND-CENTER-NEURAL-SEED.md",
        "workflow/active/portfolio-world-blender-art/02-command-center-integration-CONTEXT.md"
      ],
      "severity": "error"
    },
    {
      "id": "invalid-base-evidence",
      "message": "The supplied result records base_sha equal to candidate_sha, yielding no task diff and preventing the claimed protected-state review from establishing a valid candidate change set.",
      "paths": [
        ".icm-local/state/review-context/command-center-neural-seed-001.json"
      ],
      "severity": "error"
    }
  ],
  "independent": true,
  "record_type": "review",
  "repository": "element-bendr/my-resume-site",
  "required_fixes": [
    "Commit the required generated seed assets, provenance, Blender cleanup source, and three review renders within the declared write scope.",
    "Reissue candidate/result evidence with the correct pre-task base SHA and ensure protected paths are unchanged or explicitly authorized before review."
  ],
  "reviewer_identity": "local/workstation:reviewer/terra",
  "reviewer_profile": "blender-terra-review",
  "schema_version": 1,
  "stage_id": "02-command-center-integration",
  "task_id": "command-center-neural-seed-001",
  "validation_summary": "Worktree is clean at 4a9fe7a. Committed result records icm-stage pass, but that evidence is contradicted by the absent required deliverables; no visual inspection was possible because the required images are not committed.",
  "verdict": "fix_required",
  "workflow_id": "portfolio-world-blender-art"
}
